"","Date","text","replies","retweets","likes","anger","anticipation","disgust","fear","joy","sadness","surprise","trust","negative","positive"
"420",2018-06-17,"billionaires like jeff bezos mark cuban  elon musk think meetings can   complete waste  time heres   meetings   major productivity killer",5,38,83,0,1,1,0,0,0,0,0,1,2
"421",2018-06-17,"billionaires like jeff bezos mark cuban  elon musk think meetings can   complete waste  time heres   meetings   major productivity killer",7,58,97,0,1,1,0,0,0,0,0,1,2
"422",2018-06-17," youre planning  apply  one   544 openings  spacex    no1 trait elon musk  looking ",2,14,25,0,1,0,0,0,0,0,1,0,1
"423",2018-06-17,"tesla will cut approximately 9   46000person workforce heres elon musks full email sent   employees  layoffs",1,21,26,0,0,0,0,0,0,0,0,0,1
"424",2017-03-28,"tesla deal boosts chinese presence  us auto tech",1,7,16,0,1,0,0,1,0,1,1,0,2
"425",2018-06-18,"  single elon musk tweet  keys  teslas india strategy",0,6,13,0,0,0,0,0,0,0,0,0,0
"426",2018-06-18,"elon musk hung    netscape lobby   90s hoping  get  job",0,10,23,0,0,0,0,0,0,0,0,0,1
"427",2018-06-18,"elon musk tells shos  twitter   3 weeks  cover  losing  money",4,11,24,2,1,0,0,1,1,1,2,1,1
"428",2018-06-18,"  single tweet elon musk revealed  teslas indianborn cfo deepak ahuja   one   really calling  shots   company entering india",1,8,16,0,0,0,0,0,0,0,0,0,0
"429",2018-06-18,"elon musk free cash handouts   government will  necessary  robots take human jobs",9,19,37,1,1,0,2,1,0,0,1,1,1
"430",2018-06-18,"investors shoing tesla   three weeks   sho position explodes elon musk warns",8,11,30,0,0,0,0,0,0,0,0,0,0
"431",2018-06-18,"teslas stock keeps rising  elon musk tweets",2,15,33,0,1,0,0,1,0,0,0,0,1
"432",2018-06-18,"investors shoing tesla   three weeks   sho position explodes elon musk warns",2,16,28,0,0,0,0,0,0,0,0,0,0
"433",2018-06-19,"sleeping   office  nothing new  elon musk   90s   frequently sleep   office couch  shower   ymca  staing  first company via",4,10,36,0,0,0,0,0,1,0,0,0,0
"434",2018-06-19,"sleeping   office  nothing new  elon musk   90s   frequently sleep   office couch  shower   ymca  staing  first company via",1,8,30,0,0,0,0,0,1,0,0,0,0
"435",2017-03-28,"teslas china business  booming",1,32,25,0,0,0,0,0,0,0,0,0,0
"436",2018-06-19,"teslas stock still   upsidejust use  right cha",4,17,48,0,0,0,0,0,0,0,0,0,0
"437",2018-06-19,"heres  elon musks big ambitions may  killing tesla",2,10,9,1,0,0,1,0,1,0,0,1,0
"438",2018-06-19,"elon musk   brother slept   office  showered   ymca   first staup",6,21,43,0,0,0,0,0,0,0,1,0,1
"439",2018-06-19," road  sweden can charge  tesla   drives",2,25,33,0,0,0,0,0,0,0,0,0,0
"440",2018-06-19,"investors shoing tesla   three weeks   sho position explodes elon musk warns",7,18,27,0,0,0,0,0,0,0,0,0,0
"441",2018-06-19,"elon musk   can help kids   border  will",41,127,309,0,0,0,0,0,0,0,0,0,0
"442",2018-06-20,"sleeping   office  nothing new  elon musk   90s   frequently sleep   office couch  shower   ymca  staing  first company via",6,20,50,0,0,0,0,0,1,0,0,0,0
"443",2018-06-20,"tesla  suing  former employee  allegedly expoing gigabytes  confidential data  included dozens  confidential photographs   video  teslas manufacturing systems",2,13,18,0,0,0,0,0,0,0,1,0,1
"444",2018-06-20,"teslas alleged rogue employee  exactly  congress  worried   selfdriving cars",0,4,9,0,0,2,0,0,1,0,1,2,0
"445",2018-06-20,"tesla  suing  former employee  allegedly expoing gigabytes  data  included dozens  confidential photographs   video  teslas manufacturing systems",1,6,15,0,0,0,0,0,0,0,1,0,1
"446",2016-11-29," selfdriving 1956 concept car shows  far tesla  advanced autonomous driving",1,10,10,0,0,0,0,0,0,0,0,0,1
"447",2017-03-28,"tencent holdings repos 5 passive stake  tesla $tsla shares  34  premarket",1,15,6,0,0,0,0,0,0,0,0,1,0
"448",2018-06-21,"tesla enhancing security  gigafactory says  got  call  exemployee threatened violence",3,5,18,1,0,0,1,0,1,0,0,1,0
"449",2018-06-21,"tesla enhancing security  gigafactory says  got call  exemployee threatened violence",2,17,14,1,0,0,1,0,1,0,0,1,0
"450",2018-06-21,"teslas alleged rogue employee  exactly  congress  worried   selfdriving cars",1,4,6,0,0,2,0,0,1,0,1,2,0
"451",2018-06-22,"tesla  suing  former employee  allegedly hacking  companys factory software heres exactly   system  via",1,7,7,0,0,0,0,0,0,0,1,0,0
"452",2018-06-22,"tesla  suing  former employee  allegedly hacking  companys factory software heres exactly   system  via",2,17,20,0,0,0,0,0,0,0,1,0,0
"453",2018-06-22,"tesla  suing  former employee  allegedly hacking  companys factory software heres exactly   system  via",1,17,22,0,0,0,0,0,0,0,1,0,0
"454",2018-06-22," case   wondering    time  elon musk barack obama  4  successful people go  bed via",6,10,22,0,2,0,1,1,1,0,1,1,1
"455",2018-06-22,"elon musk uses language equivalent   seventh grader  speaking  earnings calls according   algorithm via",25,11,20,0,1,0,0,0,0,0,1,1,0
"456",2018-06-22," central question  inspired   elon musks businesses",2,5,3,0,0,0,0,1,0,1,1,0,2
"457",2018-06-22,"tesla repos another fire  fremont factory",4,6,11,0,0,0,1,0,0,0,0,0,0
"458",2017-03-28,"tesla rejects racial harassment lawsuit filed  assembly line worker",3,6,9,2,0,1,2,0,2,1,1,2,1
"459",2018-06-22,"tesla  suing  exemployee  hacking   mos softwareheres   system ",1,8,11,0,0,0,0,0,0,0,1,0,0
"460",2018-06-22," time elon musk barack obama  4  successful people go  bed",9,4,22,0,2,0,0,1,0,0,1,0,1
"461",2018-06-22,"tesla shares drop  analyst raises concern   rise   services costs",2,8,9,0,1,0,0,0,0,0,1,0,1
"462",2018-06-22,"elon musk uses seventhgrader language  earnings calls according  algorithm",6,4,11,0,1,0,0,0,0,0,1,1,0
"463",2018-06-22,"elon musk used language equivalent   seventh grader  speaking  earnings calls according   algorithm via",22,8,21,0,1,0,0,0,0,0,1,1,0
"464",2018-06-22,"teslas move last week  cut 9   workforce will sharply downsize  residential solar business  bought two years ago   controversial $26 billion deal",0,4,4,1,1,0,0,1,0,1,1,1,1
"465",2018-06-23," central question  inspired   elon musks businesses",1,6,6,0,0,0,0,1,0,1,1,0,2
"466",2018-06-23,"investors shoing tesla   three weeks   sho position explodes elon musk warns
",17,43,76,0,0,0,0,0,0,0,0,0,0
"467",2018-06-23," case   wondering    time  elon musk barack obama  4  successful people go  bed via",6,14,42,0,2,0,1,1,1,0,1,1,1
"468",2018-06-24,"elon musks  boring company said  won  competition  build  highspeed express train connecting downtown chicago   ohare international airpo",4,17,62,0,1,0,0,0,0,0,0,2,1
"469",2017-03-29,"oped  elon musks neuralink  end  huing average americans",4,4,9,0,0,0,0,0,0,0,0,0,0
"470",2018-06-24,"billionaires like jeff bezos mark cuban  elon musk think meetings can   complete waste  time heres   meetings   major productivity killer",9,59,122,0,1,1,0,0,0,0,0,1,2
"471",2018-06-24," case   wondering    time  elon musk barack obama  4  successful people go  bed via",6,7,16,0,2,0,1,1,1,0,1,1,1
"472",2018-06-24,"elon musk uses language equivalent   seventh grader  speaking  earnings calls according   algorithm via",10,8,26,0,1,0,0,0,0,0,1,1,0
"473",2018-06-25,"heres  elon musks big ambitions may  killing tesla",1,3,6,1,0,0,1,0,1,0,0,1,0
"474",2018-06-25," road  sweden can charge  tesla   drives",2,63,127,0,0,0,0,0,0,0,0,0,0
"475",2018-06-25,"elon musk  repoedly running  exclusive private school   spacexs headquaers",10,14,31,0,0,0,0,0,0,0,1,0,0
"476",2018-06-26,"elon musk explains  impoance   humans need  build civilization  space  order  extend life   planets",14,20,34,0,0,0,0,0,0,0,1,0,3
"477",2018-06-26,"elon musk explains  impoance   humans need  build civilization  space  order  extend life   planets",9,13,25,0,0,0,0,0,0,0,1,0,3
"478",2018-06-26,"goldman sachs  reiterating  sell rating  tesla  expects  electric car makers widely watched model 3 delivery number  fall sho  wall street expectations",2,6,11,1,1,0,1,1,2,1,0,2,3
"479",2018-06-26,"elon musk       build civilizations  space",15,23,38,0,0,0,0,0,0,0,0,0,1
"480",2017-03-29,"oped  elon musks neuralink  help  rich get richer",4,10,12,0,0,0,0,0,0,0,0,0,0
"481",2018-06-26,"elon musk  repoedly running  exclusive private school   spacexs headquaers",8,26,55,0,0,0,0,0,0,0,1,0,0
"482",2018-06-26,"goldman reiterates sell  tesla  expects model 3 deliveries  miss estimates",8,18,30,0,0,0,0,0,0,0,0,0,1
"483",2018-06-27,"elon musk  repoedly running  exclusive private school   spacexs headquaers",3,26,36,0,0,0,0,0,0,0,1,0,0
"484",2018-06-27,"elon musk said   companywide email  model 3 production skeptics     rude awakening",12,26,70,0,1,0,0,0,0,0,0,0,2
"485",2018-06-27,"elon musk said   companywide email  model 3 production skeptics     rude awakening",1,12,40,0,1,0,0,0,0,0,0,0,2
"486",2018-06-28,"theyll get money   need  tesla bull explains  hes still optimistic",1,3,13,1,1,0,0,1,0,1,1,0,1
"487",2018-06-28,"tesla  allowing  model 3 reservation holders  noh america  order  electric sedans    additional price  $2500",7,7,12,0,0,0,0,1,0,1,0,0,2
"488",2018-06-28,"tesla  asking model 3 reservation holders  another $2500  order  cars",9,16,14,0,0,0,0,0,0,0,0,0,1
"489",2018-06-28,"tesla  lagging  model 3 production workers tell reuters",4,7,5,1,2,1,0,0,1,0,0,1,2
"490",2018-06-28,"phtesla test driver says next roadster will  proper weapon  060 mph speed claims  actually conservative",1,4,21,0,0,0,0,1,0,0,1,0,2
"491",2017-03-29,"teslas   make  record high  heres  im cashing  trader",2,6,5,0,0,0,0,0,0,0,0,0,0
"492",2018-06-28,"bill gates says gamer bots  elon muskbacked nonprofit  huge milestone  ai",0,9,27,0,0,0,0,0,0,0,0,0,0
"493",2018-06-28,"bill gates says gamer bots  elon muskbacked nonprofit  huge milestone  ai",0,10,26,0,0,0,0,0,0,0,0,0,0
"494",2018-06-28,"tesla test driver says next roadster will  proper weapon  060 mph speed claims  actually conservative",6,12,39,0,0,0,0,1,0,0,1,0,2
"495",2018-06-29,"billionaires like jeff bezos mark cuban  elon musk think meetings can   complete waste  time heres   meetings   major productivity killer",3,42,79,0,1,1,0,0,0,0,0,1,2
"496",2018-06-29," case   wondering    time  elon musk barack obama  4  successful people go  bed via",5,16,30,0,2,0,1,1,1,0,1,1,1
"497",2018-06-29,"tesla  sta turning  profit  year says analyst",4,22,39,0,1,0,0,0,0,0,1,0,1
"498",2018-06-29,"teslas stock   nearly 2000   $17 per share ipo   held eight years ago today",5,19,29,0,1,0,0,1,0,0,1,0,1
"499",2018-06-29,"tesla still isnt profitable 8 years   ipo   hasnt  alone",2,9,5,0,0,0,0,0,0,0,0,0,0
"500",2018-06-29,"teslas nearly 2000 gain   ipo eight years ago shows power  disruption  profits",7,12,41,1,1,0,1,1,0,1,0,1,1
"501",2018-06-29,"teslas ipo  8 years ago today  take  look back   electric vehicle makers growth ever since",0,14,11,0,0,0,0,1,0,1,0,0,2
"502",2017-03-30,"spacex chief musk sets new bar  reusable rocket engine",1,26,40,1,0,0,0,0,0,0,0,0,0
"503",2018-06-29,"tesla  allowing  model 3 reservation holders  noh america  order  electric sedans    additional price  $2500",4,9,7,0,0,0,0,1,0,1,0,0,2
"504",2018-06-29,"tesla  asking model 3 reservation holders  another $2500  order  cars",4,8,12,0,0,0,0,0,0,0,0,0,1
"505",2018-06-29," selffunded staup  trying  beat tesla   market   electric trucks",1,28,36,0,0,0,0,1,0,1,0,0,1
"506",2018-06-29,"elon musk tweets  features   new tesla pickup truckand hes taking suggestions",4,4,13,0,0,0,0,0,0,0,0,0,0
"507",2018-06-30," teslas effo  revamp  cars  made puts elon musk   company  pressure",6,9,18,0,0,0,0,0,0,0,0,1,0
"508",2018-06-30," case   wondering    time  elon musk barack obama  4  successful people go  bed via",6,6,18,0,2,0,1,1,1,0,1,1,1
"509",2018-06-30,"elon musk said   companywide email  model 3 production skeptics     rude awakening",10,7,37,0,1,0,0,0,0,0,0,0,2
"510",2018-06-30," case   wondering    time  elon musk barack obama  4  successful people go  bed via",4,17,38,0,2,0,1,1,1,0,1,1,1
"511",2018-07-01," just became  real car company read  elon musk said  tesla churned  5000 model 3s",9,16,54,0,0,0,0,0,0,0,1,0,2
"512",2018-07-01,"tesla meets selfimposed deadline  model 3 rolls  5000 cars   week reuters",20,76,132,0,0,0,0,0,0,0,0,0,1
"513",2017-04-02,"tesla beats expectations delivering  record 25000 vehicles  q1",5,58,98,0,0,0,0,0,0,0,0,0,0
"514",2018-07-01,"kimbal musk backs  restaurant chain  charges lower prices  poor neighborhoods",4,9,22,0,0,0,0,0,1,0,0,1,0
"515",2018-07-01," tesla can   keep  bears  bay   pivotal trading week via",2,6,6,0,0,0,0,0,0,0,0,0,0
"516",2018-07-02," shouting elon musk  changing rules inside teslas model 3 sprint",3,8,18,0,0,0,0,0,0,0,0,0,1
"517",2018-07-02," shouting elon musk  changing rules inside telsas model 3 sprint",0,17,14,0,0,0,0,0,0,0,0,0,1
"518",2018-07-02,"tesla produced 7000 cars including 5000 model 3 electric sedans   last week  q2",0,4,21,0,0,0,0,1,0,1,0,0,3
"519",2018-07-02,"kimbal musk backs  restaurant chain  charges lower prices  poor neighborhoods",1,3,20,0,0,0,0,0,1,0,0,1,0
"520",2018-07-02,"tesla will  profitable  september says gene munster",7,9,32,0,0,0,0,0,0,0,0,0,0
"521",2018-07-02,"can tesla sustain production  5000 model 3 vehicles per week two analysts debate  closing bell",20,15,57,0,1,0,0,0,0,0,0,0,3
"522",2018-07-02,"fords european boss escalates  growing feud  tesla",1,4,4,1,0,0,0,0,0,0,0,1,0
"523",2018-07-02,"tesla shares closed  despite model 3 goal announcement   company still   lot  prove",4,12,10,0,1,0,0,0,0,0,0,0,2
"524",2017-04-03,"tesla shares hit alltime high  strong deliveries numbers",5,29,20,1,0,0,0,0,0,0,0,1,1
"525",2018-07-02,"",4,9,13,0,0,0,0,0,0,0,0,0,0
"526",2018-07-02,"tesla downgraded  sell  cfra predicts model 3 production rate   sustainable",1,8,12,0,1,0,0,0,0,0,0,0,2
"527",2018-07-02,"elon musk sleeps   desk even   youtube star raised $9000   couch",0,16,24,0,1,0,0,1,1,0,1,0,1
"528",2018-07-02,"dell tesla  kkr  making headlines  morning",0,9,6,0,0,0,0,0,0,0,0,0,0
"529",2018-07-02,"billionaire elon musk  changing  plan   tunneling venture",5,9,18,0,1,0,0,0,0,0,0,0,0
"530",2018-07-02,"tesla engineering leader doug field  left  company",2,19,13,0,0,0,0,0,0,0,1,0,1
"531",2018-07-03,"wall street   impressed  teslas model 3 milestone stock falls   negative notes",3,3,10,0,0,0,0,0,1,0,0,1,1
"532",2018-07-03,"wall street seems unimpressed  teslas model 3 production milestone via",0,9,11,0,1,0,0,0,0,0,0,1,2
"533",2018-07-03,"tesla stopped  brake  roll test   pushed  hit model 3 goals",1,8,5,1,0,0,0,0,0,0,0,1,1
"534",2018-07-03,"   time  elon musk barack obama  4  successful people go  bed via",8,9,16,0,2,0,0,1,0,0,1,0,1
"535",2017-04-03,"elon musk trolls tesla sho sellers",2,12,16,0,0,0,0,0,0,0,0,0,0
"536",2018-07-03,"though elon musk  experience working long hours   pressure  admits     overcome 1 bad habit   road  success",3,14,23,1,2,1,1,1,1,0,0,2,2
"537",2018-07-04,"elon musks 6 productivity rules include walking   meetings  waste  time",5,31,64,0,1,1,0,0,0,0,0,1,2
"538",2018-07-04,"multibillionaire elon musk  arrived  noh america  17  $2000",13,77,216,0,0,0,0,0,0,0,0,0,0
"539",2018-07-05,"tesla ceo elon musk said  twitter  repoers  publishing false  misleading aicles   company",15,17,36,1,0,1,0,0,0,0,0,1,0
"540",2018-07-05,"want  think like bill gates  elon musk   50 books   inspired tech titans",1,14,29,0,0,0,0,1,0,1,1,0,1
"541",2018-07-05,"billionaires like jeff bezos mark cuban  elon musk think meetings can   complete waste  time heres   meetings   major productivity killer",5,28,66,0,1,1,0,0,0,0,0,1,2
"542",2018-07-05,"elon musk lashes    media ",5,12,18,0,0,0,0,0,0,0,0,0,0
"543",2018-07-05,"elon musk  repoedly running  exclusive private school   spacexs headquaers",8,17,37,0,0,0,0,0,0,0,1,0,0
"544",2018-07-05,"",3,17,19,0,0,0,0,0,0,0,0,0,0
"545",2018-07-05,"    consumer repos speaks even elon musk listens",3,17,17,0,0,0,0,0,0,0,0,0,0
"546",2017-04-03,"neil degrasse tyson says  wont board spacex  elon musk sends  mom  mars  back",6,21,41,0,2,0,0,0,0,0,0,0,0
"547",2018-07-05,"elon musk lashes    media ",17,11,40,0,0,0,0,0,0,0,0,0,0
"548",2018-07-05,"elon musk takes  twitter  criticize media organizations  ",7,7,10,1,0,1,1,0,1,0,0,1,0
"549",2018-07-05,"investors betting  tesla  getting killed     reason  may think cramer",2,7,16,0,0,0,0,0,0,0,0,0,1
"550",2018-07-05," electric semi  trying  beat tesla  market",2,13,34,0,0,0,0,1,0,1,0,0,1
"551",2018-07-06,"elon musk  sending  team  engineers  thailand  assist  cave rescue",12,109,332,0,1,0,0,1,0,1,3,0,2
"552",2018-07-06,"elon musk  sending engineers  2   companies  thailand  assist   rescue   boys soccer team trapped   cave via",5,68,140,0,1,0,0,1,0,1,3,0,2
"553",2018-07-06," tesla   bear market cha watcher points  two technical yellow flags   pain via",5,4,9,1,0,0,2,0,1,0,0,1,0
"554",2018-07-06,"elon musk says  crucial skill   made steve jobs  bill gates successful",2,11,33,0,1,0,0,1,0,0,2,0,2
"555",2018-07-06,"elon musk  sending  team  engineers  thailand  assist  cave rescue",15,121,377,0,1,0,0,1,0,1,3,0,2
"556",2018-07-06,"elon musk says  crucial skill   made steve jobs  bill gates successful via",5,20,74,0,1,0,0,1,0,0,2,0,2
"557",2016-11-29,"sec slaps teslas wrist  tailored accounting practices",1,5,5,0,0,0,0,0,0,0,0,0,0
"558",2017-04-04," cha shows  theres still food   table  tesla shares",2,11,11,0,0,0,0,1,0,0,1,0,1
"559",2018-07-07," electric semi  trying  beat tesla  market",4,27,60,0,0,0,0,1,0,1,0,0,1
"560",2018-07-08,"   time  elon musk barack obama  4  successful people go  bed via",9,12,40,0,2,0,0,1,0,0,1,0,1
"561",2018-07-08,"elon musks 6 productivity rules include walking   meetings  waste  time",7,51,113,0,1,1,0,0,0,0,0,1,2
"562",2018-07-09,"musk proposes rescuing boys trapped  thai cave   submarine made  spacex rocket pa",2,6,21,1,0,0,0,0,0,0,0,0,0
"563",2018-07-09,"elon musk  taking   media    matter  tesla investors ",4,7,10,0,0,0,0,0,0,0,0,0,0
"564",2018-07-09,"   time  elon musk barack obama  4  successful people go  bed via",0,7,18,0,2,0,0,1,0,0,1,0,1
"565",2018-07-10,"elon musk takes submarine  thai cave  rescue chief repoedly calls   practical",17,14,26,0,2,0,0,1,0,1,2,1,1
"566",2018-07-10,"elon musk says  minisubmarine can  used   things",43,18,62,0,0,0,0,0,0,0,0,0,0
"567",2018-07-10,"elon musk took  spacex submarine   thai cave rescue  left    future use",7,10,32,0,1,0,0,1,0,1,1,0,1
"568",2018-07-10,"tesla said tuesday  signed  agreement  build  factory  china  make  electric cars",4,19,23,0,0,0,0,1,0,1,1,0,3
"569",2017-04-04,"cramer elon musks tesla needs  make  lot  cars  justify  skyhigh stock price",5,8,11,0,0,0,0,0,0,0,0,0,0
"570",2018-07-10,"elon musk takes submarine  thai cave  rescue chief repoedly calls   practical",11,28,62,0,2,0,0,1,0,1,2,1,1
"571",2018-07-10,"tesla ditches reservations opens  model 3 car sales   customers  noh america",11,26,57,0,0,0,0,0,0,0,0,0,1
"572",2018-07-10,"tesla shares rise  repo carmaker planning massive china factory",3,19,20,0,1,0,0,0,0,0,1,0,1
"573",2018-07-11," keeping  eye  teslas stock following news   will  longer require reservations  potential buyers   model 3 car",0,6,12,0,0,0,0,0,0,0,0,0,1
"574",2018-07-11,"tesla opens  model 3 car sales   customers  noh america without  reservation deposit",1,15,29,0,0,0,0,0,0,0,0,0,1
"575",2018-07-11,"tesla whistleblower retains law firm famous  winning $225 million monsanto suit",6,11,16,0,1,1,0,1,1,1,2,0,2
"576",2018-07-11," july 5th elon musk criticized business insider senior finance repoer",5,6,13,0,0,0,0,0,0,0,0,0,0
"577",2018-07-11,"tesla opens  model 3 car sales   customers  noh america without  reservation deposit",3,10,16,0,0,0,0,0,0,0,0,0,1
"578",2018-07-11,"billionaires like jeff bezos mark cuban  elon musk think meetings can   complete waste  time heres   meetings   major productivity killer",2,18,33,0,1,1,0,0,0,0,0,1,2
"579",2018-07-11,"elon musk  repoedly running  exclusive private school   spacexs headquaers",6,16,36,0,0,0,0,0,0,0,1,0,0
"580",2017-04-04,"tesla shares break $300   first time",5,38,54,0,1,0,0,0,0,1,0,0,0
"581",2018-07-11,"linette lopez  business insider senior finance repoer  elon musk criticized  twitter   tesla repoing discusses  incident",31,6,14,0,0,0,0,0,0,1,0,0,0
"582",2018-07-11," case   wondering    time  elon musk barack obama  4  successful people go  bed via",5,15,18,0,2,0,1,1,1,0,1,1,1
"583",2018-07-12,"tesla whistleblower retains law firm famous  winning $225 million monsanto suit",4,11,20,0,1,1,0,1,1,1,2,0,2
"584",2018-07-12,"tesla factory workers repoedly drank red bull walked  raw sewage  meet model 3 quotas",35,22,34,0,0,1,0,0,0,0,0,1,1
"585",2018-07-12," 23yearold founded  company  selfdriving car tech thats giving tesla  competition",1,6,14,0,1,0,0,0,0,0,0,1,1
"586",2018-07-12," meet model 3 quotas tesla factory workers  provided free red bull  stay awake  instructed  walk  raw sewage  avoid interrupting production according   repo",17,38,33,0,1,1,1,0,0,0,0,2,2
"587",2018-07-12," 23yearold founded  company  selfdriving car tech thats giving tesla  competition",4,24,38,0,1,0,0,0,0,0,0,1,1
"588",2018-07-12,"repos  harsh conditions  intense pressure continue  emerge   tesla factory unnamed employees said  factory provided free red bull energy drinks  battle exhaustion fueling  zombielike trance  called  tesla stare",24,49,68,2,2,1,1,1,1,1,2,5,2
"589",2018-07-12,"heres   23yearold founded  company   selfdriving car technology thats giving tesla  competition",0,9,13,0,1,0,0,0,0,0,0,1,2
"590",2018-07-13," youtube star referred  $10 million  tesla sales  get  free car via",3,11,39,0,1,0,0,1,0,0,1,0,1
"591",2017-04-04,"trump adviser cohn touts elon musks infrastructure solution tunnels",6,3,7,0,0,0,0,0,0,1,1,0,2
"592",2018-07-13,"tesla rolled   new attendance policy  hourly workers  monthread  ",5,9,10,0,1,0,0,0,0,0,1,0,0
"593",2018-07-13,"youtube star referred  $10 million  tesla sales  get  free car",2,12,27,0,1,0,0,1,0,0,1,0,1
"594",2018-07-13,"elon musk whatever pain tesla factory workers felt  wanted mine   worse",5,15,36,0,0,0,2,0,2,0,0,2,0
"595",2018-07-14,"elon musk   new interest group    added   list  enemies cabbies ",4,4,12,0,0,0,0,0,0,0,0,0,1
"596",2018-07-14,"youtube star ben sullins   facilitated  $10 million  tesla sales  scored  biggest prize available  teslas referral program  free founders series next gen roadster via",3,11,37,0,1,0,0,2,0,0,3,0,2
"597",2018-07-14," near 27mile los angeles tunnel  elon musks boring company  nearly completeand ready  demonstrations",124,1300,5200,0,1,0,0,0,0,0,0,1,0
"598",2018-07-14," electric semi  trying  beat tesla  market",5,57,94,0,0,0,0,1,0,1,0,0,1
"599",2018-07-15," 23yearold founded  company  selfdriving car tech thats giving tesla  competition",1,33,49,0,1,0,0,0,0,0,0,1,1
"600",2018-07-15,"elon musk insists hes neither democrat  republican  political contributions come  fire",10,10,13,0,0,0,1,0,0,0,0,0,0
"601",2018-07-15,"elon musk opens tesla model 3 sales    auto sales expes say consumers may want  wait",6,11,18,0,1,0,0,0,0,0,0,1,1
"602",2017-04-05,"teslas multitrillion dollar oppounity",0,18,31,0,0,0,0,0,0,0,0,0,0
"603",2018-07-15,"elon musk cous new controversy  tweeting  deleting  attack   british cave explorer",11,18,24,1,0,0,1,0,0,0,0,2,0
"604",2018-07-16," 23yearold founded  company  selfdriving car tech thats giving tesla  competition",9,18,57,0,1,0,0,0,0,0,0,1,1
"605",2018-07-16,"tesla shares fell  british diver vernon unswoh began considering legal action  elon musks baseless pedo guy claim",17,25,32,0,0,0,0,0,1,0,1,2,2
"606",2018-07-16," british diver involved   mission  save 12 thai boys   soccer coach  considering legal action  elon musk   tesla boss labeled  pedo guy",5,16,25,0,0,0,0,1,0,0,3,0,3
"607",2018-07-16,"thai rescue mission diver mulls legal action  elon musk calls  pedo guy",8,12,22,0,2,0,0,1,0,1,3,1,3
"608",2018-07-16," internships helped elon musk figure   future",0,4,15,0,0,0,0,0,0,0,0,0,0
"609",2018-07-16,"tesla falls 2  british diver mulls legal action  elon musks baseless pedo guy claim",6,60,43,0,0,0,0,0,0,0,1,1,2
"610",2018-07-17,"tesla sinks  elon musk tweets  via",2,12,23,0,0,0,0,0,0,0,0,0,0
"611",2018-07-17,"shares  tesla took  nosedive monday  elon musk facing fresh criticism",2,4,5,1,0,0,0,0,1,0,0,1,0
"612",2018-07-17,"tech vc slams elon musk  thinskinned  shotempered",5,10,15,0,0,0,0,0,0,0,0,0,0
"613",2017-04-06,"tesla bulls  stuck   matrix says analyst",1,4,6,0,1,0,0,0,0,0,1,0,1
"614",2018-07-17,"elon musk  thinskinned  shotempered says tech vc",18,10,29,0,0,0,0,0,0,0,0,0,0
"615",2018-07-17,"heres   youtuber referred $10 million  sales  teslaand won  free car",2,7,19,0,0,0,0,0,0,0,0,0,0
"616",2018-07-18," talk  journalists   time   never received inside information   journalist   time says jim chanos  response  elon musks insider information allegation",8,9,17,1,1,0,0,0,0,0,0,1,4
"617",2018-07-18,"elon musk needs  take  twitter sabbatical gene munster says",7,5,14,0,0,0,0,0,0,0,0,0,0
"618",2018-07-18,"elon musk  thinskinned  shotempered says tech vc",10,13,24,0,0,0,0,0,0,0,0,0,0
"619",2018-07-18,"sho seller jim chanos hits back  elon musk  overpromising  tesla",2,5,13,0,0,0,0,0,0,0,0,0,0
"620",2018-07-19,"tesla shares fall  needham downgrades  sell citing possible increase  model 3 cancellations",8,15,15,0,0,0,0,0,1,0,0,1,2
"621",2018-07-19,"   steve jobs bill gates  elon musk learned  internships",8,48,81,0,0,0,0,0,0,0,0,0,0
"622",2018-07-19,"teslas battery maker suspends cobalt supplier amid sanctions concern",1,5,2,1,0,0,0,0,0,0,0,1,0
"623",2018-07-19,"teslas battery maker suspends cobalt supplier   sanctions concern",1,13,8,1,0,0,0,0,0,0,0,1,0
"624",2017-04-06,"cramer remix  teslas haters  get run ",0,4,3,0,0,0,0,0,0,0,0,0,0
"625",2018-07-19,"   top 5 moments  elon musks battle   press",2,4,5,1,1,0,0,0,0,0,1,1,1
"626",2018-07-19,"elon musk   increasingly combative  twitter lately  thats worrying  investors",5,11,23,1,1,0,2,0,1,0,0,2,0
