"","Date","text","replies","retweets","likes","anger","anticipation","disgust","fear","joy","sadness","surprise","trust","negative","positive"
"1044",2018-09-17,"kimbal musk elon working hard  tesla shareholders focus   delivering  model 3",6,2,12,0,0,0,0,0,0,0,0,0,3
"1045",2018-09-17,"elon musk sued   cave rescue diver  called  pedo guy  child rapist",12,27,56,0,2,0,0,2,0,1,1,0,2
"1046",2017-04-25,"workers involved  union activities say tesla  illegally intimidating ",1,8,9,0,0,0,0,0,0,0,0,0,0
"1047",2018-09-17,"musk says tesla  now  delivery logistics hell",4,13,12,1,1,1,1,0,1,0,0,1,1
"1048",2018-09-17,"elon musk tweeted  new concept photos  spacecraft designed  fly around  moon",1,17,34,0,0,0,0,0,0,0,0,0,0
"1049",2018-09-17,"tesla dips  saudi wealth fund invests $1 billion  competitor lucid motors",7,16,16,0,0,0,0,1,0,0,1,0,1
"1050",2018-09-17,"elon musk said hes months away  announcing  neurolink  connects  brain  computers",29,83,136,0,0,0,0,0,0,0,0,0,0
"1051",2018-09-17,"tesla briefly dips  goes positive  saudi wealth fund invests $1 billion  competitor lucid motors",2,12,23,0,0,0,0,1,0,0,1,0,1
"1052",2018-09-18,"tesla  headed   graveyard predicts former gm exec bob lutz",11,11,9,0,0,0,0,0,0,0,0,0,0
"1053",2018-09-18,"audi just rolled   allelectric suv  hopes will cut  teslas dominance   luxury ev market heres  scott keogh audi  america president   say",6,15,25,0,0,0,0,1,0,0,1,0,2
"1054",2018-09-18,"elon musk considers going   moon",8,8,33,0,0,0,0,0,0,0,0,0,0
"1055",2018-09-18,"tesla says justice depament requested documents  ceo musks takeprivate tweet",0,8,7,0,0,0,0,0,0,0,1,0,1
"1056",2018-09-18,"elon needs  stay   company  just definitely needs      structure   board  prevent    things  happening   future says loup ventures gene munster  elon musks behavior",6,10,16,0,1,0,1,0,0,0,1,0,1
"1057",2017-04-26,"consumer repos cuts ratings  tesla  brake software issue",1,6,6,0,0,0,0,0,0,0,0,0,0
"1058",2018-09-18,"elon musks announcement   first private passenger  spacex   moon shot  puts  ahead  boeing   new space race",2,7,21,1,2,0,1,0,1,1,0,1,1
"1059",2018-09-18,"audi just rolled   allelectric suv  hopes will cut  teslas dominance   luxury ev market heres  scott keogh audi  america president   say",6,18,34,0,0,0,0,1,0,0,1,0,2
"1060",2018-09-18,"audis etron car shows just  far behind teslas competition  ubs says",1,17,34,0,1,0,0,0,0,0,0,1,0
"1061",2018-09-18,"elon musk sued   cave rescue diver  called  pedo guy  child rapist",3,6,16,0,2,0,0,2,0,1,1,0,2
"1062",2018-09-18,"elon musk considers going   moon maybe   join   spacex flight",16,14,48,0,0,0,0,0,0,0,0,0,1
"1063",2018-09-18,"developing tesla slides  news   company faces  criminal probe  elon musks statements  going private",4,22,30,1,0,1,1,0,0,0,0,1,0
"1064",2018-09-19,"hes   game  town hes  best thing weve  since thomas edison neil degrasse tyson says  elon musk via",15,68,182,0,0,0,0,0,0,0,0,0,0
"1065",2018-09-19,"tesla may   around  10 years  musk keeps relying  baitandswitch tactics autonations ceo says",9,13,15,0,0,0,1,0,0,0,1,0,0
"1066",2018-09-19,"us futures  modestly higher 
teslas stock remains  watch 
questions linger   uschina trade war
   headlines  stocks  watching  morning",5,14,16,0,2,1,3,0,0,0,2,3,1
"1067",2018-09-19,"tesla tilray  netflix  among  stocks  watch  morning",16,10,19,0,1,0,1,0,0,0,0,1,0
"1068",2017-04-27,"elon musk ousted  head   company tesla bought  november",2,6,13,0,0,0,0,0,0,0,0,0,0
"1069",2018-09-20," tesla model 3  earned  perfect 5star safety rating   national highway traffic safety administration",4,19,65,1,2,0,1,2,1,0,2,1,3
"1070",2018-09-20,"teslas model 3  earned  perfect 5star safety rating   national highway traffic safety administration  car  received criticism   past   autopilot driver assist system  nhtsa  investigating incidents involving  system",2,13,36,2,2,0,1,2,2,0,4,2,5
"1071",2018-09-20,"tesla loses another exec vp  supply chain management liam oconnor",13,11,14,0,0,0,0,0,0,0,1,0,2
"1072",2018-09-20,"elon musk asks  simple interview question  tell   job applicant  lying via",6,15,25,1,1,1,0,0,0,0,0,1,2
"1073",2018-09-21,"tesla rival nio    tear since  debut  market watchers  cautious via",1,11,16,0,1,0,1,0,0,0,1,0,1
"1074",2018-09-22,"elon musk said hes months away  announcing  neurolink  connects  brain  computers",339,927,2000,0,0,0,0,0,0,0,0,0,0
"1075",2018-09-23,"hes   game  town hes  best thing weve  since thomas edison neil degrasse tyson says  elon musk via",10,24,73,0,0,0,0,0,0,0,0,0,0
"1076",2018-09-23,"elon musk asks  simple interview question  tell   job applicant  lying via",6,15,26,1,1,1,0,0,0,0,0,1,2
"1077",2018-09-24,"tesla made  big deal    solar roof  2016   almost two years since      tiles",5,8,22,0,1,0,0,1,0,1,1,0,1
"1078",2018-09-24,"tesla made  big deal    solar roof  2016   almost two years since      tiles",22,33,44,0,1,0,0,1,0,1,1,0,1
"1079",2017-04-27,"tesla exec ousted  clashing  ceo musk",1,7,4,1,0,0,1,0,0,0,0,1,0
"1080",2018-09-24,"tesla made  big deal    solar roof  2016   almost two years since      tiles",4,9,31,0,1,0,0,1,0,1,1,0,1
"1081",2018-09-25,"elon musk asks  simple interview question  tell   applicant  lying via",11,11,27,1,1,1,0,0,0,0,0,1,1
"1082",2018-09-25," ever happened  teslas solar roof tiles",4,37,61,0,0,0,0,0,0,0,0,0,0
"1083",2018-09-25,"elon musk isnt   entrepreneur   family tree heres  look   rest   members   musk clan",6,45,87,1,1,1,0,1,0,1,2,0,2
"1084",2018-09-25," ever happened  teslas solar roof tiles",12,44,82,0,0,0,0,0,0,0,0,0,0
"1085",2018-09-25,"cramers lightning round teslas stock   much   battleground  ",2,6,10,1,0,0,1,0,0,1,0,0,0
"1086",2018-09-26,"donald trump  elon musk   least one thing  commontwitter trash talking",5,12,23,0,0,1,0,0,1,1,0,1,0
"1087",2018-09-27,"sho seller andrew left surprised  market reaction  musk charge  think  halo existed",0,4,11,0,0,0,0,0,0,1,0,0,0
"1088",2018-09-27,"elon musk calls sec fraud lawsuit unjustified says  acted  best interests  investors",8,11,11,2,1,1,1,0,1,1,1,4,0
"1089",2018-09-27,"stocks making  biggest moves  hours tesla progress software  ",0,5,12,0,1,0,0,1,0,0,0,1,1
"1090",2017-04-27," crucial money decision teslas elon musk made    broke",0,14,21,1,1,0,1,1,1,1,2,1,2
"1091",2018-09-27,"sec says musk chose $420 price  tesla shares    pot reference",15,44,99,0,0,0,0,0,0,0,0,0,0
"1092",2018-09-27,"watch sec holds press conference  suing tesla ceo elon musk",2,23,17,0,1,0,1,0,0,0,0,0,0
"1093",2018-09-27,"tesla shares drop sharply afterhours  news  tesla  ceo elon musk   sued   sec $tsla",9,60,60,0,0,0,0,0,0,0,0,0,0
"1094",2018-09-27,"tesla shares drop   10  sec charges ceo elon musk  fraud $tsla",0,14,21,1,0,0,0,0,0,0,0,1,0
"1095",2018-09-27,"former sec chair says musk   removed  ceo  civil case go  jail  criminally charged",10,40,49,0,0,0,2,0,2,0,0,2,1
"1096",2018-09-27," sec charges tesla elon musk  fraud$tsla",85,430,475,1,0,0,0,0,0,0,0,1,0
"1097",2018-09-27,"musks fraud charge will   force  positive change  tesla says tech investor munster $tsla",5,9,13,2,0,0,2,0,0,0,0,2,0
"1098",2018-09-28," new york times jim stewa  fathom  elon musk turned   settlement offer   sec  order  avoid fraud charges",7,18,16,1,0,0,1,0,0,0,0,2,1
"1099",2018-09-28," sec  sued tesla ceo elon musk  fraud now  happens next  seven expes debate   lawsuit  mean   automaker   leader",4,19,29,2,0,1,1,0,1,1,1,2,2
"1100",2018-09-28,"jason calacanis ",4,11,36,0,0,0,0,0,0,0,0,0,0
"1101",2017-04-27,"elon musk ousted  head   company tesla bought  november",1,11,13,0,0,0,0,0,0,0,0,0,0
"1102",2018-09-28," tesla loses  battle   sec  agency  force musk  step  temporarily  permanently
",11,20,28,2,0,0,1,0,0,0,0,2,0
"1103",2018-09-28,"tesla shares plunged  double digits   worst session  nearly 5 years   sec sued musk  fraud heres  five expes  saying   stock via",1,11,16,1,0,0,0,0,0,0,0,1,0
"1104",2018-09-28,"comcast wins  bid  sky trump speaks   un  fed raises rates tensions  passions flare   kavanaugh hearing   sec sues elon musk heres  week  review",2,7,13,0,0,0,1,0,0,1,0,1,1
"1105",2018-09-28,"  tells us   board   strategic plan must  using  jim jones jonestown suicide pact   drinking  kool aid   founder jeff sonnenfeld says  teslas board   decision  turn   secs settlement",5,10,11,1,2,0,1,0,1,0,1,2,2
"1106",2018-09-28,"cramer  stands   elon musks sec conflict   hubris",6,5,15,1,0,0,1,0,1,0,0,1,0
"1107",2018-09-28,"cramer remix  stock  like tesla except  making money",6,6,16,1,1,0,0,1,0,1,1,0,1
"1108",2018-09-28,"elon musk thought   verbal agreement  saudis  considered using spacex stake repo",5,6,19,0,1,0,0,0,0,0,1,0,1
"1109",2018-09-28," sec  sued tesla ceo elon musk  fraud now  happens next  seven expes debate   lawsuit  mean   automaker   leader",10,9,27,2,0,1,1,0,1,1,1,2,2
"1110",2018-09-28," new york times jim stewa  fathom  elon musk turned   settlement offer   sec  order  avoid fraud charges",12,28,57,1,0,0,1,0,0,0,0,2,1
"1111",2018-09-28,"musk  gambling  nearly  third  teslas value   settle columbia law professor",1,10,21,0,1,0,0,0,0,1,2,1,1
"1112",2016-11-10,"cramer explains  investors   love  tesla",3,8,12,0,0,0,0,1,0,0,0,0,1
"1113",2016-12-07,"tesla recalls charging adapters  overheating",1,8,9,0,0,0,0,0,0,0,0,0,0
"1114",2017-04-28,"auto companies   teslas biggest competitors says analyst",3,4,6,0,1,0,0,0,0,0,1,0,1
"1115",2018-09-28,"",4,11,13,0,0,0,0,0,0,0,0,0,0
"1116",2018-09-28,"elon musk  others   acting like mentheyre acting like children says nyu professor",10,10,31,0,0,0,0,0,0,0,1,0,1
"1117",2018-09-28,"secs musk complaint   road map  criminal charges says nyt repoer jim stewa heres  musk  eventually end   jail",4,17,18,2,0,1,2,0,1,0,0,3,0
"1118",2018-09-28," sec charges tesla elon musk  fraud $tsla",11,35,24,1,0,0,0,0,0,0,0,1,0
"1119",2018-09-28,"elon musk calls sec fraud lawsuit unjustified says  acted  best interests  investors",5,7,18,2,1,1,1,0,1,1,1,4,0
"1120",2018-09-28,"teslas musk pulled plug  settlement  sec  last minute",9,10,16,0,0,0,0,0,0,0,0,0,0
"1121",2018-09-28,"citi downgrades tesla  sell says  stock   risky  buy even  big pullback",7,25,29,0,1,0,1,0,0,0,0,1,0
"1122",2018-09-28,"tesla shares plunge  wall street throws  towel saying musk depaure  cost stock $130",7,20,43,0,0,0,1,0,0,0,0,1,0
"1123",2018-09-28,"pueo rico governor ricardo rosselló discusses hurricane maria recovery effos working  elon musk  energy units   statehood battle  pueo rico",1,2,11,1,0,0,1,0,0,0,1,2,2
"1124",2018-09-28,"sec fraud charges arent   legal woes tesla ceo elon musk  facing",4,7,13,1,0,0,0,0,0,0,1,1,1
"1125",2017-04-28,"video shows elon musks plan  massive underground freeway system",5,27,42,0,1,0,0,0,0,0,1,0,0
"1126",2018-09-28,"live watch teslas stock trade  real time following news  ceo elon musk   sued   sec  fraud",6,41,48,1,2,0,1,0,0,0,2,1,1
"1127",2018-09-28," wont lose  faith  long  hes     jail  will  lose faith",2,10,18,1,3,1,2,1,2,1,1,2,1
"1128",2018-09-28,"elon musk backed    deal   sec  settle allegations  fraud   comments  taking tesla private repoedly saying   settling    failing   true  ",9,15,21,2,2,0,1,1,1,1,1,2,1
"1129",2018-09-28," company  one disastrous mess bob lutz former vice chairman  gm says teslas board  thank elon musk   job well done   politely ask   step   ceo",21,18,33,1,1,1,1,0,1,0,1,3,2
"1130",2018-09-29,"sec settles charges  teslas elon musk will remain  ceo  relinquish chairman role",161,1000,1400,0,0,0,0,0,0,0,1,1,1
"1131",2018-09-29,"tesla made  big deal    solar roof  2016  two years later   barely shipped   happened",13,35,66,0,1,0,0,1,0,1,1,0,1
"1132",2018-09-29," ever happened  teslas solar roof tiles",13,43,101,0,0,0,0,0,0,0,0,0,0
"1133",2018-09-29,"  can put together legos  can put together  tesla says  tesla owner  decided  take repairs    hands",12,21,60,0,0,0,0,0,0,0,0,0,0
"1134",2018-09-30,"even   sec lawsuit settled   still  shoes  drop  musk  tesla",11,6,19,1,0,1,1,0,1,1,0,1,0
"1135",2018-09-30,"elon musk tells tesla staff  ignore  distractions hints   profitable",8,21,58,0,0,0,0,0,0,0,0,1,0
"1136",2017-04-28,"scientists think facebook  elon musk  way  optimistic  mindreading tech",1,8,6,0,0,0,0,0,0,0,0,0,0
"1137",2018-10-01,"tesla shares surge  15 percent  sec settlement",2,18,40,0,0,0,0,0,0,1,0,0,0
"1138",2018-10-01,"tesla made  record 80000 vehicles last quaer repo says",4,32,80,0,0,0,0,0,0,0,0,0,0
"1139",2018-10-01,"tesla shares  soaring 5 expes weigh    comes next via",2,13,21,0,1,0,0,0,0,0,1,0,0
"1140",2018-10-01,"tesla will screen cars 3  gigafactory  thank   employees",3,8,19,0,0,0,0,0,0,0,0,0,0
"1141",2018-10-01,"heres  three expes  viewing tesla  elon musk settled   sec",5,12,13,0,0,0,0,0,0,0,0,0,0
"1142",2018-10-01," $20 million sec fine  elon musk  basically like  speeding ticket   average american",13,21,56,0,0,0,0,0,0,0,0,0,0
"1143",2018-10-01,"russia   answer   tesla   made   people behind  ak47",18,27,47,0,0,0,0,0,0,0,0,0,0
"1144",2018-10-02,"elon musks dream   30 minute commute  los angeles  san francisco just took one major step closer  becoming  reality   unveiling   full sized passenger capsule",7,63,99,0,1,0,0,0,0,0,0,0,3
"1145",2018-10-02,"billionaire ron baron believes tesla   $1 trillion  revenue  2030",7,18,50,0,0,0,0,0,0,0,0,0,0
"1146",2018-10-02,"elon musk will step   tesla chairman  settle fraud charges   gets  remain ceo heres  look    duties will change via",4,15,19,1,0,0,1,0,0,0,1,1,1
"1147",2017-05-01,"  whats  elon musks brain right now",0,9,11,0,0,0,0,0,0,0,0,0,0
"1148",2018-10-02," group  internet sleuths says hordes  parked teslas 
  reveal whether demand   companys cars   high  elon musk  suggested",11,9,18,1,0,0,0,0,0,0,0,1,0
"1149",2018-10-02," view   got  parking ticket       now    lot  careful    tweets    smokes says dezenhall resources ceo eric dezenhall  elon musks $20 million sec settlement",5,6,11,0,0,0,0,1,0,0,1,0,2
"1150",2018-10-02," testdrive   say    crazy car ron baron now  major tesla shareholder discusses   invested",7,11,56,1,0,0,1,0,1,0,0,1,1
"1151",2018-10-02,"tesla produced 83500 vehicles   3rd quaer",2,26,65,0,0,0,0,0,0,0,0,0,0
"1152",2018-10-02," think     $500 billion battery business $500 billion car business  give  better  5050 chance major tesla shareholder ron baron says  fact      $60 billion company  3 years  give  maybe 80 chance",13,42,116,1,0,0,0,0,0,1,1,1,1
"1153",2018-10-02,"tesla says  getting killed  china   tariffs",12,27,36,0,0,0,0,0,0,0,0,0,0
"1154",2018-10-02,"audi just rolled   allelectric suv  hopes will cut  teslas dominance   luxury ev market heres  scott keogh audi  america president   say",7,19,52,0,0,0,0,1,0,0,1,0,2
"1155",2018-10-02,"major tesla shareholder ron baron investors  benefit  elon musk tweeted less",16,14,39,0,0,0,0,0,0,0,0,0,2
"1156",2018-10-02," multibillionaire tesla ceo elon musk paying  $20 million fine  comparable  paying  speeding ticket   average american via",9,22,65,0,0,0,0,0,0,0,0,0,0
"1157",2018-10-02,"investors  benefit    less communications tesla investors   better   musk tweeted less major tesla shareholder ron baron says heres     say  elon musks settlement   sec",3,4,9,0,0,0,0,0,0,0,0,0,2
"1158",2017-05-01," cha makes  case  buying tesla ahead  earnings",1,11,14,0,0,0,1,0,1,0,0,1,1
"1159",2018-10-03,"  can put together legos  can put together  tesla says  tesla owner  decided  take repairs    hands",1,5,17,0,0,0,0,0,0,0,0,0,0
"1160",2018-10-03,"elon musks ultimatum  tesla fight  sec   quit",10,10,16,2,0,0,2,0,0,0,0,3,0
"1161",2018-10-03,"tesla shares drop  analysts worry  china trade war risk",6,11,18,0,2,0,3,0,1,0,1,3,0
"1162",2018-10-03,"elon musk threatened  quit unless teslas board agreed  fight  sec  ended   forced  step   chairman anyways",5,27,26,1,1,0,2,0,0,0,2,3,2
"1163",2018-10-03,"donald trump  elon musk   least one thing  commontwitter trash talking",8,12,26,0,0,1,0,0,1,1,0,1,0
"1164",2018-10-04,"us judge asks musk  sec  justify fraud settlement  fair  reasonable",4,10,16,1,0,0,0,0,0,0,0,1,1
"1165",2018-10-04,"mark cuban repoedly urged elon musk  settle  dispute   sec  charges  defrauded investors",5,15,16,1,0,0,0,0,0,0,0,1,0
"1166",2018-10-04,"cadillac   better system  tesla consumer repos ranks gm higher  tesla   test  4    popular automated driving systems",5,10,17,0,0,0,0,0,0,0,1,0,0
"1167",2018-10-04,"developing tesla ceo elon musk mocked  sec   tweet thursday calling  agency  shoseller enrichment commission days  settling fraud charges brought  ",22,45,98,1,0,0,0,0,0,0,1,1,0
"1168",2018-10-04,"stocks making  biggest moves  hours tesla costco  ",0,10,10,0,0,0,0,0,0,0,0,1,0
"1169",2017-05-01,"elon musk loves norway   quick look  capital city oslo shows ",3,12,22,0,0,0,0,0,0,0,0,0,0
"1170",2018-10-04," bad habit annoys richard branson  will get  fired  tesla via",7,12,24,1,0,1,1,0,1,0,0,1,0
"1171",2018-10-04,"gm tops tesla  ranking  automated driving systems",4,15,22,0,0,0,0,0,0,0,0,0,0
"1172",2018-10-04,"elon musk accuses blackrock  helping sho sellers",2,18,30,0,0,0,0,0,0,0,0,0,0
"1173",2018-10-04,"tesla ceo elon musk mocked  sec   tweet thursday calling  agency  shoseller enrichment commission days  settling fraud charges brought  ",5,8,15,1,0,0,0,0,0,0,1,1,0
"1174",2018-10-04,"teslas automated driving system   strong system   doesnt  enough safeguards thats    ranked  2  gms winning automated driving system  consumer repos",5,18,32,0,1,1,0,1,1,1,2,0,1
"1175",2018-10-05," elon musk    nuts      id  keeping  super low profile roger mcnamee says",4,8,17,0,0,0,0,0,0,0,0,0,0
"1176",2018-10-05,"roger mcnamee elevation paners cofounder  early facebook investor  mike volpi index ventures cofounder join squawk alley  discuss tesla ceo elon musks latest tweets mocking  sec   investors  going  respond",0,1,6,1,1,1,1,1,1,0,1,1,2
"1177",2018-10-05,"tesla shares   tanking due   tweet ceo elon musk sent deriding  sec   shoseller enrichment commission",7,9,12,0,0,0,0,0,0,0,1,0,0
"1178",2018-10-05," kind  behavior will  take  stock  $1 trillion",4,12,22,0,0,0,0,1,0,0,1,0,1
"1179",2018-10-05,"elon musks use  twitter  dangerous  needs   controlled   companys board former sec chair says harvey pitt",30,26,53,0,1,0,1,0,0,0,0,1,0
"1180",2017-05-02,"tesla linked  investment   supply chain firm  focuses  recycling",0,6,16,0,0,0,0,0,0,0,0,0,1
"1181",2018-10-05,"tesla shares drop nearly 5  musk mocks sec  twitter",15,28,43,0,0,0,0,0,0,0,0,0,0
"1182",2018-10-05,"einhorn  tesla like lehman  think  deception    catch   tsla",6,4,9,0,0,0,0,0,0,1,0,1,0
"1183",2018-10-06," ever happened  teslas solar roof tiles",7,31,72,0,0,0,0,0,0,0,0,0,0
"1184",2018-10-06,"tesla made  big deal    solar roof  2016  two years later   barely shipped   happened",3,13,24,0,1,0,0,1,0,1,1,0,1
"1185",2018-10-07," bad habit annoys richard branson  will get  fired  tesla via",4,23,39,1,0,1,1,0,1,0,0,1,0
"1186",2018-10-08,"teslas board may   able  rein  musk",4,6,11,0,1,0,0,0,0,0,0,1,0
"1187",2018-10-08,"tesla says  model 3  lowest probability  injury    cars ever tested  nhtsa",6,23,44,1,1,0,1,0,2,0,0,2,1
"1188",2018-10-08,"russia   answer   tesla   made   people behind  ak47",4,20,34,0,0,0,0,0,0,0,0,0,0
"1189",2018-10-08,"teslas board  directors may   able  control elon musks behaviorno matter   consequences  former federal securities attorney said",4,11,20,1,1,0,1,0,0,0,2,0,1
"1190",2018-10-08,"bill gates elon musk  mark cuban quit  3 bad habits   became successful heres   can  via",7,31,41,1,1,1,1,1,1,0,1,2,1
"1191",2017-05-02,"10 things  learned  elon musks ted interview",0,12,16,0,0,0,0,0,0,0,0,0,0
"1192",2018-10-09,"richard branson gives elon musk  advice learn  delegate  get  sleep",1,18,40,0,0,0,0,0,0,0,2,0,2
"1193",2018-10-09,"elon musks outbursts   attempts  push back  status quo says linkedin cofounder  worked alongside musk  paypal",9,18,26,0,0,0,0,0,0,0,0,0,1
"1194",2018-10-09,"tesla    path  profitability  year   70 stock gain macquarie says",13,40,112,0,1,0,0,1,0,0,0,0,1
"1195",2018-10-09,"richard branson   advice  elon musk learn  delegate  get  sleep",3,11,35,0,0,0,0,0,0,0,2,0,2
"1196",2018-10-09,"richard branson  one piece  advice  fellow billionaire entrepreneur elon musk",5,13,37,0,0,0,0,0,0,0,2,0,1
"1197",2018-10-09,"shares  chinese electric car maker nio jump 22  tesla investor takes  stake",2,14,24,0,0,0,0,2,0,1,0,0,2
"1198",2018-10-09,"elon musks outbursts   attempts  push back  status quo says linkedin cofounder",2,14,23,0,0,0,0,0,0,0,0,0,1
"1199",2018-10-10," might think youre clever    survive  brainteaser elon musk uses  screen potential employees via",10,13,24,0,0,0,0,0,0,0,0,0,2
"1200",2018-10-10,"tesla  close  securing  $145 million plot  land   planned factory  shanghai china",3,6,20,0,0,1,1,0,0,0,0,1,1
"1201",2018-10-10,"tesla    path  profitability  year   70 stock gain macquarie says",8,10,30,0,1,0,0,1,0,0,0,0,1
"1202",2017-05-02,"  watch   tesla releases earnings",3,7,7,0,1,0,1,0,0,0,0,0,0
"1203",2018-10-11,"sec  tesla suppo  approval   settlement",4,4,5,0,0,0,0,0,0,0,0,0,1
"1204",2018-10-11,"ft says james murdoch   line  tesla chair elon musks reply wrong",2,6,13,0,0,0,0,0,0,0,0,1,0
"1205",2018-10-11,"oregon claws back $13 million  tesla  inflated solar credits repo says",1,15,21,0,0,0,0,0,0,0,0,1,0
"1206",2018-10-12,"tesla produced 7400 model 3 sedans   first two weeks   quaer repo says",9,6,21,0,0,0,0,0,0,0,0,0,1
"1207",2018-10-12,"tesla says orders placed  oct 15  eligible   full tax credit  $7500",4,11,21,0,0,0,0,0,1,0,1,1,3
"1208",2018-10-12,"  can put together legos  can put together  tesla says  tesla owner  decided  take repairs    hands",2,14,28,0,0,0,0,0,0,0,0,0,0
"1209",2018-10-12,"elon musks tesla seeks  trademark teslaquila  teasing  teslabranded tequila earlier  year",21,32,85,1,0,0,1,0,0,0,0,1,0
"1210",2018-10-13," ever happened  teslas solar roof tiles",4,44,77,0,0,0,0,0,0,0,0,0,0
"1211",2018-10-13,"bill gates elon musk  mark cuban quit  3 bad habits   became successful heres   can  via",1,10,26,1,1,1,1,1,1,0,1,2,1
"1212",2018-10-13," bad habit annoys richard branson  will get  fired  tesla via",2,13,25,1,0,1,1,0,1,0,0,1,0
"1213",2017-05-02,"  watch   tesla releases earnings",0,6,9,0,1,0,1,0,0,0,0,0,0
"1214",2018-10-13,"bill gates elon musk  mark cuban quit  3 bad habits   became successful heres   can  via",7,32,61,1,1,1,1,1,1,0,1,2,1
"1215",2018-10-13,"richard branson gives elon musk  advice learn  delegate  get  sleep",5,38,126,0,0,0,0,0,0,0,2,0,2
"1216",2018-10-13," teslabranded tequila coming",22,16,63,0,1,0,0,0,0,0,0,0,0
"1217",2018-10-14,"donald trump  elon musk   least one thing  commontwitter trash talking",3,2,12,0,0,1,0,0,1,1,0,1,0
"1218",2018-10-14,"tesla says orders placed  oct 15  eligible   full tax credit  $7500",3,16,36,0,0,0,0,0,1,0,1,1,3
"1219",2018-10-16,"elon musks $20 million settlement   sec  fraud allegations   approved   judge",1,15,14,1,0,0,0,0,0,0,0,1,0
"1220",2018-10-16,"tesla shares jumped nearly 5   news   judge  approved elon musks settlement  sec",1,12,19,0,0,0,0,0,0,0,0,0,0
"1221",2018-10-17,"tesla amazon apple waymo gm ford   leading  selfdriving car race",4,17,34,0,0,0,0,0,0,0,1,0,0
"1222",2018-10-17,"elon musk intends  buy $20 million  tesla stock",10,46,85,0,0,0,0,0,0,0,0,0,0
"1223",2018-10-17,"tesla vp  manufacturing gilbe passin  left  company",3,10,7,0,0,0,0,0,0,0,0,0,0
"1224",2016-12-12,"elon musk  planning  meet trump says source",3,7,14,0,1,0,0,0,0,1,1,0,1
"1225",2017-05-02,"   elon musk gets  motivation",1,12,12,0,0,0,0,0,0,0,0,0,0
"1226",2018-10-17,"tesla buys new plot   first china factory",3,18,26,0,0,0,0,0,0,0,0,0,0
"1227",2018-10-18,"tesla vp  manufacturing gilbe passin  left  company",4,8,8,0,0,0,0,0,0,0,0,0,0
"1228",2018-10-18,"tesla ceo elon musk just introduced  lowercost midrange model 3 via twitter",9,17,37,0,0,0,0,0,0,0,0,0,1
"1229",2018-10-19,"elon musks extreme micromanagement  wasted time  money  tesla insiders say",9,17,26,2,2,1,0,1,0,1,1,1,1
"1230",2018-10-19,"tesla ceo elon musk introduced  lowercost midrange model 3 via twitter    base $45000 sticker price   adveised  costing $30700  estimated savings",28,23,74,0,0,0,0,0,0,0,1,0,2
"1231",2018-10-19,"elon musk announced  twitter  tesla  now selling  new lowerpriced version   model 3 vehicles",6,14,30,0,0,0,0,0,0,0,0,0,1
"1232",2018-10-19,"tesla ceo elon musk tweeted   lowercost midrange   companys model 3 electric sedan  going  sale today",4,7,24,0,0,0,0,1,0,1,0,0,2
"1233",2018-10-19,"billionaire mark cuban offered  simple advice recently  elon musk   via",11,12,41,0,0,0,0,0,0,0,1,0,0
"1234",2018-10-20,"bill gates elon musk  mark cuban quit  3 bad habits   became successful heres   can  via",5,12,37,1,1,1,1,1,1,0,1,2,1
"1235",2018-10-20,"  revealed last week  elon musk intends  buy $20 million  tesla stock adding     $9 billion  shares  already owns",5,15,40,0,0,0,0,0,0,0,0,0,0
"1236",2017-05-02,"10 things  learned  elon musks ted interview",0,13,20,0,0,0,0,0,0,0,0,0,0
"1237",2018-10-20,"richard branson says elon musk  learn  delegate  get  sleep",8,26,75,0,0,0,0,0,0,0,1,0,2
"1238",2018-10-21,"tesla amazon apple waymo gm ford   leading  selfdriving car race",8,54,74,0,0,0,0,0,0,0,1,0,0
"1239",2018-10-21,"musk   known  approve expensive hightech projects  tesla    advice    direct repos",8,13,27,0,0,0,0,1,0,0,2,0,1
"1240",2018-10-21," bad habit annoys richard branson  will get  fired  tesla via",6,7,29,1,0,1,1,0,1,0,0,1,0
"1241",2018-10-22,"elon musk rapidtransit test tunnel  la opens  public dec 10",2,13,43,0,1,0,0,0,0,0,0,0,1
"1242",2018-10-22,"elon musk says first highspeed transit tunnel  almost done  will open  dec 10",1,20,31,0,0,0,0,0,0,0,0,0,0
"1243",2018-10-22,"elon musk announced last week  tesla  now selling  new lowerpriced version   model 3 vehicles",2,6,12,0,0,0,0,0,0,0,0,0,1
"1244",2018-10-22," government policies  taxpayer money  helped elon musk  tesla",5,9,13,1,1,0,1,1,0,1,1,1,1
